dbn,school_name,num_of_sat_test_takers,sat_math_avg._score,sat_writing_avg._score,sat_critical_readng_avg._score,pct_students_tested,academic_tier_rating
23K514,FREDERICK DOUGLASS ACADEMY VII HIGH SCHOOL,55,371,359,361,85,3.0
23K643,BROOKLYN DEMOCRACY ACADEMY,11,338,331,349,78,2.0
23K646,ASPIRATIONS DIPLOMA PLUS HIGH SCHOOL,7,371,311,311,78,4.0
23K647,METROPOLITAN DIPLOMA PLUS HIGH SCHOOL,17,346,332,350,78,2.579081632653061
23K697,TEACHERS PREPARATORY HIGH SCHOOL,69,416,388,392,92,1.0
24Q264,ACADEMY OF FINANCE AND ENTERPRISE,89,454,421,405,85,2.579081632653061
24Q267,HIGH SCHOOL OF APPLIED COMMUNICATION,39,413,400,406,85,1.0
24Q293,CIVIC LEADERSHIP ACADEMY,69,429,407,404,85,4.0
24Q296,PAN AMERICAN INTERNATIONAL HIGH SCHOOL,55,323,311,317,78,1.0
24Q299,BARD HIGH SCHOOL EARLY COLLEGE II,155,568,550,545,78,2.579081632653061
24Q455,NEWTOWN HIGH SCHOOL,320,440,380,383,92,4.0
24Q457,YOUNG ADULT BOROUGH CENTER AT ARTS AND BUSINESS HS,110,418,394,401,92,3.0
24Q485,GROVER CLEVELAND HIGH SCHOOL,241,420,396,395,78,2.0
24Q520,MIDDLE COLLEGE HIGH SCHOOL AT LAGUARDIA COMMUNITY COLLEGE,58,393,385,399,85,3.0
24Q530,INTERNATIONAL HIGH SCHOOL AT LAGUARDIA COMMUNITY COLLEGE,69,409,329,326,92,4.0
24Q550,HIGH SCHOOL FOR ARTS AND BUSINESS,138,403,380,391,92,2.0
24Q560,"ROBERT F. WAGNER, JR. SECONDARY SCHOOL FOR ARTS AND TECHNOLOGY",80,447,440,443,85,2.579081632653061
24Q600,QUEENS VOCATIONAL AND TECHNICAL HIGH SCHOOL,155,447,406,417,85,4.0
24Q610,AVIATION CAREER & TECHNICAL EDUCATION HIGH SCHOOL,396,496,423,445,92,3.0
24Q744,VOYAGES PREPARATORY,110,418,394,401,85,2.579081632653061
25Q252,"QUEENS SCHOOL OF INQUIRY, THE",58,498,443,455,78,3.0
25Q263,FLUSHING INTERNATIONAL HIGH SCHOOL,45,417,318,314,85,1.0
25Q281,EASTsWEST SCHOOL OF INTERNATIONAL STUDIES,59,463,392,416,85,1.0
25Q285,WORLD JOURNALISM PREPARATORY: A COLLEGE BOARD SCHOOL,63,489,481,471,85,3.0
25Q425,JOHN BOWNE HIGH SCHOOL,558,451,395,397,78,2.0
25Q460,FLUSHING HIGH SCHOOL,347,441,382,393,85,1.0
25Q467,FLUSHING YABC,9,373,344,378,78,4.0
25Q525,TOWNSEND HARRIS HIGH SCHOOL,278,651,638,621,78,1.0
25Q540,QUEENS ACADEMY HIGH SCHOOL,17,382,388,398,85,2.0
25Q670,ROBERT F. KENNEDY COMMUNITY HIGH SCHOOL,99,458,441,431,92,2.0
25Q792,NORTH QUEENS COMMUNITY HIGH SCHOOL,7,421,377,379,78,1.0
26Q415,BENJAMIN N. CARDOZO HIGH SCHOOL,888,545,489,480,78,4.0
26Q430,FRANCIS LEWIS HIGH SCHOOL,934,539,467,468,85,1.0
26Q435,MARTIN VAN BUREN HIGH SCHOOL,334,397,384,391,78,3.0
26Q495,BAYSIDE HIGH SCHOOL,708,523,464,462,85,4.0
26Q566,"QUEENS HIGH SCHOOL OF TEACHING, LIBERAL ARTS AND THE SCIENCES",175,434,420,425,85,4.0
27Q260,FREDERICK DOUGLASS ACADEMY VI HIGH SCHOOL,87,385,373,387,85,3.0
27Q262,CHANNEL VIEW SCHOOL FOR RESEARCH,74,419,401,432,78,2.0
27Q302,"QUEENS HIGH SCHOOL FOR INFORMATION, RESEARCH, AND TECHNOLOGY",44,401,364,391,85,4.0
27Q308,ROBERT H. GODDARD HIGH SCHOOL OF COMMUNICATION ARTS AND TECHNOLOGY,93,426,416,423,85,4.0
27Q309,ACADEMY OF MEDICAL TECHNOLOGY: A COLLEGE BOARD SCHOOL,36,379,348,367,92,2.579081632653061
27Q323,SCHOLARS' ACADEMY,89,537,496,499,78,3.0
27Q400,AUGUST MARTIN HIGH SCHOOL,101,371,360,377,78,4.0
27Q410,BEACH CHANNEL HIGH SCHOOL,78,396,354,384,85,1.0
27Q475,RICHMOND HILL HIGH SCHOOL,404,404,368,382,78,4.0
27Q480,JOHN ADAMS HIGH SCHOOL,403,409,392,391,92,1.0
27Q650,"HIGH SCHOOL FOR CONSTRUCTION TRADES, ENGINEERING AND ARCHITECTURE",194,491,425,429,85,3.0
28Q284,YORK EARLY COLLEGE ACADEMY,110,418,394,401,78,4.0
28Q310,QUEENS COLLEGIATE: A COLLEGE BOARD SCHOOL,68,445,400,420,78,4.0
28Q325,HILLSIDE ARTS & LETTERS ACADEMY,110,418,394,401,92,1.0
28Q338,QUEENS SATELLITE HIGH SCHOOL FOR OPPORTUNITY,6,408,367,403,92,4.0
28Q350,JAMAICA GATEWAY TO THE SCIENCES,25,452,425,430,78,2.0
28Q440,FOREST HILLS HIGH SCHOOL,762,497,454,456,78,1.0
28Q470,JAMAICA HIGH SCHOOL,90,414,353,342,92,3.0
28Q505,HILLCREST HIGH SCHOOL,462,413,386,395,85,2.0
28Q620,THOMAS A. EDISON CAREER AND TECHNICAL EDUCATION HIGH SCHOOL,422,478,442,452,85,2.0
28Q680,QUEENS GATEWAY TO HEALTH SCIENCES SECONDARY SCHOOL,99,523,502,513,85,1.0
28Q686,QUEENS METROPOLITAN HIGH SCHOOL,110,418,394,401,78,3.0
28Q687,QUEENS HIGH SCHOOL FOR THE SCIENCES AT YORK COLLEGE,121,660,596,612,92,2.0
28Q690,HIGH SCHOOL FOR LAW ENFORCEMENT AND PUBLIC SAFETY,74,406,384,406,85,4.0
28Q896,"YOUNG WOMEN'S LEADERSHIP SCHOOL, QUEENS",68,445,432,439,92,1.0
29Q248,QUEENS PREPARATORY ACADEMY,52,380,359,360,85,2.579081632653061
29Q259,PATHWAYS COLLEGE PREPARATORY SCHOOL: A COLLEGE BOARD SCHOOL,46,397,375,401,92,1.0
29Q265,EXCELSIOR PREPARATORY HIGH SCHOOL,49,398,402,402,85,2.579081632653061
29Q272,GEORGE WASHINGTON CARVER HIGH SCHOOL FOR THE SCIENCES,59,427,424,436,92,2.0
29Q283,PREPARATORY ACADEMY FOR WRITERS: A COLLEGE BOARD SCHOOL,43,414,363,370,85,3.0
29Q326,CAMBRIA HEIGHTS ACADEMY,110,418,394,401,78,2.579081632653061
29Q492,"MATHEMATICS, SCIENCE RESEARCH AND TECHNOLOGY MAGNET HIGH SCHOOL",78,426,394,400,92,2.579081632653061
29Q494,"LAW, GOVERNMENT AND COMMUNITY SERVICE HIGH SCHOOL",52,377,377,385,85,2.579081632653061
29Q496,"BUSINESS, COMPUTER APPLICATIONS & ENTREPRENEURSHIP HIGH SCHOOL",49,414,359,379,85,3.0
29Q498,HUMANITIES & ARTS MAGNET HIGH SCHOOL,62,381,377,393,78,2.579081632653061
30Q286,"YOUNG WOMEN'S LEADERSHIP SCHOOL, ASTORIA",110,418,394,401,78,2.0
30Q301,ACADEMY FOR CAREERS IN TELEVISION AND FILM,98,440,405,410,78,4.0
30Q445,WILLIAM CULLEN BRYANT HIGH SCHOOL,395,449,412,414,85,4.0
30Q450,LONG ISLAND CITY HIGH SCHOOL,392,420,395,403,92,3.0
30Q501,FRANK SINATRA SCHOOL OF THE ARTS HIGH SCHOOL,174,496,494,504,92,2.0
30Q502,INFORMATION TECHNOLOGY HIGH SCHOOL,148,434,398,407,85,4.0
30Q555,NEWCOMERS HIGH SCHOOL,143,475,329,323,78,2.0
30Q575,ACADEMY OF AMERICAN STUDIES,135,492,491,487,85,4.0
30Q580,BACCALAUREATE SCHOOL FOR GLOBAL EDUCATION,61,568,544,524,78,3.0
31R047,CSI HIGH SCHOOL FOR INTERNATIONAL STUDIES,137,451,450,452,92,4.0
31R064,GAYNOR MCCOWN EXPEDITIONARY LEARNING SCHOOL,61,412,385,398,92,1.0
31R080,THE MICHAEL J. PETRIDES SCHOOL,107,488,466,472,85,1.0
31R440,NEW DORP HIGH SCHOOL,391,437,416,424,92,1.0
31R445,PORT RICHMOND HIGH SCHOOL,271,438,417,424,85,3.0
31R450,CURTIS HIGH SCHOOL,375,435,429,437,92,4.0
31R455,TOTTENVILLE HIGH SCHOOL,807,486,470,462,92,2.579081632653061
31R460,SUSAN E. WAGNER HIGH SCHOOL,535,474,459,455,85,2.0
31R470,CONCORD HIGH SCHOOL,10,455,414,466,85,3.0
31R600,RALPH R. MCKEE CAREER AND TECHNICAL EDUCATION HIGH SCHOOL,94,422,397,416,85,3.0
31R605,STATEN ISLAND TECHNICAL HIGH SCHOOL,227,682,636,635,85,2.0
31R607,YOUNG ADULT BOROUGH CENTER AT STATEN IS TECH HS,10,375,370,405,78,1.0
32K403,ACADEMY FOR ENVIRONMENTAL LEADERSHIP,50,366,352,380,92,2.579081632653061
32K545,EBC HIGH SCHOOL FOR PUBLIC SERVICE–BUSHWICK,88,409,361,384,85,3.0
32K549,BUSHWICK SCHOOL FOR SOCIAL JUSTICE,75,353,334,348,85,3.0
32K552,ACADEMY OF URBAN PLANNING,67,364,354,342,92,3.0
32K554,ALL CITY LEADERSHIP SECONDARY SCHOOL,39,465,422,428,85,2.0
32K556,BUSHWICK LEADERS HIGH SCHOOL FOR ACADEMIC EXCELLENCE,23,358,350,347,92,2.0
32K564,BUSHWICK COMMUNITY HIGH SCHOOL,24,317,358,359,92,4.0
75K371,P.S. 371 s LILLIAN L. RASHKIS,110,418,394,401,85,1.0
75M035,P.S. 035,110,418,394,401,85,4.0
75Q256,P.S. Q256,110,418,394,401,85,1.0
75Q811,P.S. Q811,32,444,433,429,78,1.0
75R025,SOUTH RICHMOND HIGH SCHOOL I.S./P.S. 25,110,418,394,401,78,1.0
75X012,P.S. X012 LEWIS AND CLARK SCHOOL,110,418,394,401,92,1.0
75X754,J. M. RAPPORT SCHOOL CAREER DEVELOPMENT,110,418,394,401,85,4.0
79M645,SCHOOL FOR COOPERATIVE TECHNICAL EDUCATION,110,418,394,401,85,1.0
79Q950,GED PLUS s CITYWIDE,8,400,426,496,92,2.0
79X490,PHOENIX ACADEMY,9,370,360,367,85,2.579081632653061
