dbn,school_name,num_test_takers,sat_reading,sat_math,sat_writing,academic_tier_rating
28Q350,JAMAICA GATEWAY TO THE SCIENCES,25,430,452,425,2
28Q440,FOREST HILLS HIGH SCHOOL,762,456,497,454,1
28Q470,JAMAICA HIGH SCHOOL,90,342,,353,3
28Q505,HILLCREST HIGH SCHOOL,462,395,413,386,2
28Q620,THOMAS A. EDISON CAREER AND TECHNICAL EDUCATION HIGH SCHOOL,422,452,478,442,2
28Q680,QUEENS GATEWAY TO HEALTH SCIENCES SECONDARY SCHOOL,99,513,523,502,1
28Q686,QUEENS METROPOLITAN HIGH SCHOOL,,,,,3
28Q687,QUEENS HIGH SCHOOL FOR THE SCIENCES AT YORK COLLEGE,121,612,660,596,2
28Q690,HIGH SCHOOL FOR LAW ENFORCEMENT AND PUBLIC SAFETY,74,406,406,384,4
28Q896,"YOUNG WOMEN'S LEADERSHIP SCHOOL, QUEENS",68,439,445,432,1
29Q248,QUEENS PREPARATORY ACADEMY,52,360,380,359,
29Q259,PATHWAYS COLLEGE PREPARATORY SCHOOL: A COLLEGE BOARD SCHOOL,46,401,397,375,1
29Q265,EXCELSIOR PREPARATORY HIGH SCHOOL,49,402,398,402,
29Q272,GEORGE WASHINGTON CARVER HIGH SCHOOL FOR THE SCIENCES,59,436,427,424,2
29Q283,PREPARATORY ACADEMY FOR WRITERS: A COLLEGE BOARD SCHOOL,43,370,,363,3
29Q326,CAMBRIA HEIGHTS ACADEMY,,,,,
29Q492,"MATHEMATICS, SCIENCE RESEARCH AND TECHNOLOGY MAGNET HIGH SCHOOL",78,400,426,394,
29Q494,"LAW, GOVERNMENT AND COMMUNITY SERVICE HIGH SCHOOL",52,385,377,377,
29Q496,"BUSINESS, COMPUTER APPLICATIONS & ENTREPRENEURSHIP HIGH SCHOOL",49,379,414,359,3
29Q498,HUMANITIES & ARTS MAGNET HIGH SCHOOL,62,393,381,377,
30Q286,"YOUNG WOMEN'S LEADERSHIP SCHOOL, ASTORIA",,,,,2
30Q301,ACADEMY FOR CAREERS IN TELEVISION AND FILM,98,410,440,405,4
30Q445,WILLIAM CULLEN BRYANT HIGH SCHOOL,395,414,449,412,4
30Q450,LONG ISLAND CITY HIGH SCHOOL,392,403,420,395,3
30Q501,FRANK SINATRA SCHOOL OF THE ARTS HIGH SCHOOL,174,504,496,494,2
30Q502,INFORMATION TECHNOLOGY HIGH SCHOOL,148,407,434,398,4
30Q555,NEWCOMERS HIGH SCHOOL,143,323,475,329,2
30Q575,ACADEMY OF AMERICAN STUDIES,135,487,492,491,4
30Q580,BACCALAUREATE SCHOOL FOR GLOBAL EDUCATION,61,524,568,544,3
31R047,CSI HIGH SCHOOL FOR INTERNATIONAL STUDIES,137,452,451,450,4
31R064,GAYNOR MCCOWN EXPEDITIONARY LEARNING SCHOOL,61,398,412,385,1
31R080,THE MICHAEL J. PETRIDES SCHOOL,107,472,488,466,1
31R440,NEW DORP HIGH SCHOOL,391,424,437,416,1
31R445,PORT RICHMOND HIGH SCHOOL,271,424,438,417,3
31R450,CURTIS HIGH SCHOOL,375,437,435,429,4
31R455,TOTTENVILLE HIGH SCHOOL,807,462,486,470,
31R460,SUSAN E. WAGNER HIGH SCHOOL,535,455,474,459,2
31R470,CONCORD HIGH SCHOOL,10,466,455,414,3
31R600,RALPH R. MCKEE CAREER AND TECHNICAL EDUCATION HIGH SCHOOL,94,416,422,397,3
31R605,STATEN ISLAND TECHNICAL HIGH SCHOOL,227,635,682,636,2
31R607,YOUNG ADULT BOROUGH CENTER AT STATEN IS TECH HS,10,405,375,370,1
32K403,ACADEMY FOR ENVIRONMENTAL LEADERSHIP,50,380,366,352,
32K545,EBC HIGH SCHOOL FOR PUBLIC SERVICE–BUSHWICK,88,384,409,361,3
32K549,BUSHWICK SCHOOL FOR SOCIAL JUSTICE,75,348,353,334,3
32K552,ACADEMY OF URBAN PLANNING,67,342,364,354,3
32K554,ALL CITY LEADERSHIP SECONDARY SCHOOL,39,428,465,422,2
32K556,BUSHWICK LEADERS HIGH SCHOOL FOR ACADEMIC EXCELLENCE,23,347,358,350,2
32K564,BUSHWICK COMMUNITY HIGH SCHOOL,24,359,317,358,4
75K371,P.S. 371 s LILLIAN L. RASHKIS,,,,,1
75M035,P.S. 035,,,,,4
75Q256,P.S. Q256,,,,,1
75Q811,P.S. Q811,32,429,444,433,1
75R025,SOUTH RICHMOND HIGH SCHOOL I.S./P.S. 25,,,,,1
75X012,P.S. X012 LEWIS AND CLARK SCHOOL,,,,,1
75X754,J. M. RAPPORT SCHOOL CAREER DEVELOPMENT,,,,,4
79M645,SCHOOL FOR COOPERATIVE TECHNICAL EDUCATION,,,,,1
79Q950,GED PLUS s CITYWIDE,8,496,400,426,2
79X490,PHOENIX ACADEMY,9,367,370,360,